{
	"$schema": "http://json-schema.org/draft-06/schema#",
	"title": "ServiceNegotiation",
	"description": "The Message that a Service sends to a Broker during version negotiation.",

	"type": "object",
	"properties": {
		"monto": { "$ref": "ProtocolVersion.json#" },
		"service": { "$ref": "SoftwareVersion.json#" },
		"extensions": {
			"title": "ServiceExtensions",
			"description": "The Service extensions supported by the Service.",

			"type": "array",
			"minItems": 1,
			"items": { "$ref": "NamespacedName.json#" },
			"uniqueItems": true
		},
		"products": {
			"title": "BrokerProductList",
			"description": "The Products a Service can produce.",

			"type": "array",
			"items": { "$ref": "ProductIdentifier.json#" },
			"uniqueItems": true
		}
	},
	"additionalProperties": false,
	"required": ["monto", "service", "products"]
}
